{
  "contract": "RRM-TRAIL-001",
  "schemaVersion": 1,
  "trailId": "PR-152@c11f1721673b",
  "repository": "safal207/robys-coffee-house-demo",
  "prNumber": 152,
  "head": "c11f1721673bbdcda5ed7b8b00e069bc54b4ac4b",
  "taskType": "review-route-selector",
  "episodeStatus": "COMPLETED",
  "depth": "L3",
  "route": {
    "decision": "ESCALATE",
    "authority": "route-selection-only",
    "selectionMode": "automatic",
    "routeId": null,
    "proposedRouteId": "route-l3-standard",
    "routeKey": null,
    "governanceExceptionRequired": false,
    "reasons": [
      "PARTIAL_ROUTE_ACTORS_coderabbit",
      "QUOTA_EXHAUSTED_codex",
      "NO_ELIGIBLE_L3_ROUTE"
    ],
    "stages": []
  },
  "evidence": [
    {
      "id": "rrm-preflight",
      "kind": "github",
      "ref": "github:actions/run/28589670503",
      "head": "c11f1721673bbdcda5ed7b8b00e069bc54b4ac4b",
      "observedAt": "2026-07-02T12:22:30Z",
      "authority": "binding",
      "digest": "sha256:c47b3aa64f0bf8c15abfd552ed8ff176b348df6b1e8877bc51bb49f7f3cc5ae2",
      "snapshot": {
        "workflow": "Review route preflight",
        "head": "c11f1721673bbdcda5ed7b8b00e069bc54b4ac4b",
        "conclusion": "success",
        "depth": "L3",
        "routeDecision": "ESCALATE"
      }
    },
    {
      "id": "codex-runtime",
      "kind": "github",
      "ref": "github:comment/4865640892",
      "head": "c11f1721673bbdcda5ed7b8b00e069bc54b4ac4b",
      "observedAt": "2026-07-02T12:24:58Z",
      "authority": "supporting",
      "digest": "sha256:11ac6b2a11782b912dc3c3c7856acd744e4a3575a85a1f8d51b900e5f4c48c93",
      "snapshot": {
        "actor": "codex",
        "status": "QUOTA_EXHAUSTED",
        "contentReviewCompleted": false
      }
    },
    {
      "id": "coderabbit-runtime",
      "kind": "github",
      "ref": "github:comment/4865613584",
      "head": "c11f1721673bbdcda5ed7b8b00e069bc54b4ac4b",
      "observedAt": "2026-07-02T12:31:00Z",
      "authority": "supporting",
      "digest": "sha256:0e826091055d050da4a36f5a79054e7ded3f8b3c2b1cba4e83ac8c1bcec500ac",
      "snapshot": {
        "actor": "coderabbit",
        "status": "PARTIAL",
        "selectedFiles": 12,
        "reviewedFiles": 0,
        "contentReviewCompleted": false
      }
    },
    {
      "id": "governance-resolution",
      "kind": "manual",
      "ref": "manual:GE-003",
      "head": "c11f1721673bbdcda5ed7b8b00e069bc54b4ac4b",
      "observedAt": "2026-07-02T12:35:30Z",
      "authority": "binding",
      "digest": "sha256:ec4b0b92a257d6982e7af57e686a0ec829760902f2ab80a78ad9318be552cd55",
      "snapshot": {
        "exception": "GE-003",
        "selectorOutcome": "ESCALATE",
        "resolution": "ACCEPTED_RISK",
        "independentAiContentReview": false,
        "proofDepth": "D6"
      }
    },
    {
      "id": "merge-outcome",
      "kind": "github",
      "ref": "github:pull/152",
      "head": "c11f1721673bbdcda5ed7b8b00e069bc54b4ac4b",
      "observedAt": "2026-07-02T12:36:13Z",
      "authority": "binding",
      "digest": "sha256:ab06e914b0041989540693ba916820e8b2b8d5a23baf429fdfa0f90aaa35f3b3",
      "snapshot": {
        "merged": true,
        "head": "c11f1721673bbdcda5ed7b8b00e069bc54b4ac4b",
        "mergeSha": "b218b6938c01524bfa3fb3d0d690fc1d8476d373"
      }
    }
  ],
  "findings": {
    "accepted": [
      {
        "id": "fail-closed-escalation",
        "source": "RRM-003",
        "summary": "The selector refused to invent an eligible L3 route when both external review actors were unavailable.",
        "evidenceIds": [
          "rrm-preflight",
          "codex-runtime",
          "coderabbit-runtime"
        ]
      }
    ],
    "rejected": [],
    "advisory": [
      {
        "id": "runtime-evidence-ingestion",
        "source": "maintainer",
        "summary": "Future automation should ingest reviewer quota and partial-analysis responses directly into roster evidence.",
        "evidenceIds": [
          "codex-runtime",
          "coderabbit-runtime",
          "governance-resolution"
        ]
      }
    ]
  },
  "outcome": {
    "status": "MERGED",
    "mergeSha": "b218b6938c01524bfa3fb3d0d690fc1d8476d373",
    "completedAt": "2026-07-02T12:36:13Z",
    "governanceException": "GE-003"
  },
  "repeatability": {
    "shouldRepeatRoute": false,
    "needsMoreRuns": true,
    "reason": "No review route was selected; repeatability must be evaluated after successful non-escalated episodes."
  },
  "recordedAt": "2026-07-02T12:37:00Z"
}
